id,title,status,phase,targeted_dates,cloud_instances,link
481517,OneDrive: Annotate with Apple Pencil Experience on OneDrive for iOS,In development,General Availability,,worldwide (standard multi-tenant);gcc;gcc high;dod,https://www.microsoft.com/microsoft-365/roadmap?featureid=481517
477363,Microsoft Purview compliance portal: Insider Risk Management - Recommended thresholds,In development,General Availability,,worldwide (standard multi-tenant);gcc;gcc high;dod,https://www.microsoft.com/microsoft-365/roadmap?featureid=477363
369345,Microsoft Teams: ‘Add emoji’ updated keyboard shortcut,Rolling out,General Availability,,worldwide (standard multi-tenant);gcc;gcc high;dod,https://www.microsoft.com/microsoft-365/roadmap?featureid=369345
391672,Microsoft To Do: Microsoft To Do availability in Outlook on the web,In development,General Availability,,gcc high;dod,https://www.microsoft.com/microsoft-365/roadmap?featureid=391672
370535,Microsoft Purview compliance portal: Data Loss Prevention - Ability to rename the policy and rule names in DLP,In development,General Availability,July CY2025,worldwide (standard multi-tenant);gcc;gcc high;dod,https://www.microsoft.com/microsoft-365/roadmap?featureid=370535
471442,Outlook: Choose save location when saving to a cloud account in the Outlook app for iOS and Android,Rolling out,General Availability,,worldwide (standard multi-tenant);gcc;gcc high,https://www.microsoft.com/microsoft-365/roadmap?featureid=471442
418119,Microsoft Teams: Collaborative Notes and Loop Components for Microsoft 365 GCC High and DoD,Rolling out,General Availability,,gcc high;dod,https://www.microsoft.com/microsoft-365/roadmap?featureid=418119
399928,Microsoft Intune: Intune Suite - Endpoint Privilege Management on single session Azure Virtual Desktop,In development,General Availability,,worldwide (standard multi-tenant);gcc;gcc high;dod,https://www.microsoft.com/microsoft-365/roadmap?featureid=399928
420326,Microsoft Teams: Bulk operations summary in the Teams admin center,Rolling out,General Availability,,worldwide (standard multi-tenant);gcc;gcc high;dod,https://www.microsoft.com/microsoft-365/roadmap?featureid=420326
418564,Microsoft Copilot (Microsoft 365): Summarize files shared in Teams chat with Copilot,Rolling out,General Availability,,worldwide (standard multi-tenant);gcc,https://www.microsoft.com/microsoft-365/roadmap?featureid=418564
416091,Outlook: Sort by Flag option,In development,General Availability,August CY2025,worldwide (standard multi-tenant);gcc;gcc high;dod,https://www.microsoft.com/microsoft-365/roadmap?featureid=416091
411581,Outlook: Additional formatting options in Outlook for iOS and Android,Launched,General Availability,,worldwide (standard multi-tenant);gcc;gcc high,https://www.microsoft.com/microsoft-365/roadmap?featureid=411581
408170,Microsoft Intune: Enhanced Device Inventory for Windows Devices for Government Cloud (GCCH),In development,General Availability,,gcc;gcc high;dod,https://www.microsoft.com/microsoft-365/roadmap?featureid=408170
81379,Microsoft Teams: Remote contact management for Teams Phone devices in Teams admin center,Rolling out,General Availability,,worldwide (standard multi-tenant);gcc;gcc high;dod,https://www.microsoft.com/microsoft-365/roadmap?featureid=81379
398981,Outlook: Updated conversation actions on Outlook for Android,Rolling out,General Availability,,worldwide (standard multi-tenant);gcc;gcc high;dod,https://www.microsoft.com/microsoft-365/roadmap?featureid=398981
392842,Microsoft Purview compliance portal: Audit - New filters in Audit Search,In development,General Availability,,gcc;gcc high;dod,https://www.microsoft.com/microsoft-365/roadmap?featureid=392842
468892,Microsoft Clipchamp: Sharing a portion of a video as a clip,Rolling out,General Availability,,worldwide (standard multi-tenant);gcc,https://www.microsoft.com/microsoft-365/roadmap?featureid=468892
464984,Microsoft Copilot (Microsoft 365) Microsoft 365 Copilot Chat general availability for GCC,Launched,General Availability,,gcc,https://www.microsoft.com/microsoft-365/roadmap?featureid=464984
468293,Microsoft Clipchamp: Advanced editing from camera,Rolling out,General Availability,,worldwide (standard multi-tenant);gcc,https://www.microsoft.com/microsoft-365/roadmap?featureid=468293
393333,OneDrive: Sync admin reports - GCC,In development,General Availability,,gcc,https://www.microsoft.com/microsoft-365/roadmap?featureid=393333
402194,Microsoft Purview compliance portal: Communication Compliance - Ability to exclude spam and bulk emails,In development,General Availability,,gcc;gcc high;dod,https://www.microsoft.com/microsoft-365/roadmap?featureid=402194
406910,Microsoft Stream: Seek bar thumbnails for Teams meeting recordings,In development,General Availability,,worldwide (standard multi-tenant);gcc;gcc high;dod,https://www.microsoft.com/microsoft-365/roadmap?featureid=406910
172024,Microsoft Purview compliance portal: Communication Compliance - Adaptive policy scope,In development,General Availability,June CY2025,gcc;gcc high;dod,https://www.microsoft.com/microsoft-365/roadmap?featureid=172024
117531,Microsoft Purview compliance portal: Information Protection - New cmdlet for Content Explorer (U.S. Government clouds),In development,General Availability,,gcc;gcc high;dod,https://www.microsoft.com/microsoft-365/roadmap?featureid=117531
93246,Microsoft Purview | Communication Compliance: Prioritize analysis of policy-driven alerts with Azure Cognitive Services (U.S. Government clouds),In development,General Availability,,gcc;gcc high;dod,https://www.microsoft.com/microsoft-365/roadmap?featureid=93246
412942,Microsoft Purview compliance portal: Insider Risk Management - User exclusion,Rolling out,General Availability,,worldwide (standard multi-tenant);gcc;gcc high;dod,https://www.microsoft.com/microsoft-365/roadmap?featureid=412942
382107,Microsoft Purview compliance portal: Insider Risk Management - Enriching Insider risk management with Communication compliance as an indicator,In development,General Availability,,gcc;gcc high;dod,https://www.microsoft.com/microsoft-365/roadmap?featureid=382107
336046,Microsoft Purview compliance portal: Communication Compliance - Enhanced Policy Conditions,In development,General Availability,,gcc;gcc high;dod,https://www.microsoft.com/microsoft-365/roadmap?featureid=336046
168843,Microsoft Purview compliance portal: Communication Compliance - Recommended policy scope,In development,General Availability,,gcc;gcc high;dod,https://www.microsoft.com/microsoft-365/roadmap?featureid=168843
165402,Microsoft Purview compliance portal: Communication Compliance - User scoping role-based access control (RBAC),In development,General Availability,,gcc;gcc high;dod,https://www.microsoft.com/microsoft-365/roadmap?featureid=165402
384871,Microsoft Purview compliance portal: eDiscovery - Review set query report,Rolling out,General Availability,,gcc high;dod,https://www.microsoft.com/microsoft-365/roadmap?featureid=384871
397771,Microsoft Purview compliance portal: Information Protection - Save filters for Activity Explorer,Launched,General Availability,,gcc;gcc high;dod,https://www.microsoft.com/microsoft-365/roadmap?featureid=397771
156015,Microsoft Purview compliance portal: Sensitivity analysis for policy tuning,Launched,General Availability,,gcc;gcc high;dod,https://www.microsoft.com/microsoft-365/roadmap?featureid=156015
395793,Outlook: Support for Auto-Expanding Archives,In development,General Availability,August CY2025,worldwide (standard multi-tenant);gcc high,https://www.microsoft.com/microsoft-365/roadmap?featureid=395793
386901,Microsoft Purview compliance portal: Information Protection - Sensitivity label grouping modernization,In development,General Availability,,gcc;gcc high;dod,https://www.microsoft.com/microsoft-365/roadmap?featureid=386901
160010,Microsoft Purview compliance portal: Optical character recognition (OCR) support for SharePoint Online and OneDrive for Business,In development,General Availability,,gcc;gcc high;dod,https://www.microsoft.com/microsoft-365/roadmap?featureid=160010
169212,Microsoft Purview compliance portal: Communication Compliance - Advanced trainable classifiers to detect workplace safety scenarios,In development,General Availability,,gcc;gcc high;dod,https://www.microsoft.com/microsoft-365/roadmap?featureid=169212
169083,Microsoft Purview compliance portal: eDiscovery - App Permissions for Graph API,Launched,General Availability,,gcc;gcc high;dod,https://www.microsoft.com/microsoft-365/roadmap?featureid=169083
379477,Microsoft Purview compliance portal: Insider Risk Management - Real-time policy tuning analysis,Launched,General Availability,,gcc;gcc high;dod,https://www.microsoft.com/microsoft-365/roadmap?featureid=379477
178292,OneDrive: Admins can configure a group policy to block specific folders from OneDrive Sync,In development,General Availability,,worldwide (standard multi-tenant);gcc;gcc high;dod,https://www.microsoft.com/microsoft-365/roadmap?featureid=178292
172016,Microsoft Purview compliance portal: Communication Compliance - Policy insights,In development,General Availability,July CY2025,gcc;gcc high;dod,https://www.microsoft.com/microsoft-365/roadmap?featureid=172016
